albumId,title,tracks.0.name,tracks.0.genre.name,tracks.1.name,tracks.1.genre.name,tracks.2.name,tracks.2.genre.name,tracks.3.name,tracks.3.genre.name,tracks.4.name,tracks.4.genre.name,tracks.5.name,tracks.5.genre.name,tracks.6.name,tracks.6.genre.name,tracks.7.name,tracks.7.genre.name,tracks.8.name,tracks.8.genre.name,tracks.9.name,tracks.9.genre.name,artist.name
325,Bartok: Violin & Viola Concertos,Sonata for Solo Violin: IV: Presto,Classical,,,,,,,,,,,,,,,,,,,Yehudi Menuhin
326,Mendelssohn: A Midsummer Night's Dream,"A Midsummer Night's Dream, Op.61 Incidental Music: No.7 Notturno",Classical,,,,,,,,,,,,,,,,,,,Philharmonia Orchestra & Sir Neville Marriner
327,Bach: Orchestral Suites Nos. 1 - 4,"Suite No. 3 in D, BWV 1068: III. Gavotte I & II",Classical,,,,,,,,,,,,,,,,,,,"Academy of St. Martin in the Fields, Sir Neville Marriner & Thurston Dart"
328,"Charpentier: Divertissements, Airs & Concerts","Concert pour 4 Parties de V**les, H. 545: I. Prelude",Classical,,,,,,,,,,,,,,,,,,,Les Arts Florissants & William Christie
329,South American Getaway,Adios nonino,Classical,,,,,,,,,,,,,,,,,,,The 12 Cellists of The Berlin Philharmonic
330,Górecki: Symphony No. 3,"Symphony No. 3 Op. 36 for Orchestra and Soprano ""Symfonia Piesni Zalosnych"" \ Lento E Largo - Tranquillissimo",Classical,,,,,,,,,,,,,,,,,,,Adrian Leaper & Doreen de Feis
331,Purcell: The Fairy Queen,"Act IV, Symphony",Classical,,,,,,,,,,,,,,,,,,,"Roger Norrington, London Classical Players"
332,The Ultimate Relexation Album,"3 Gymnopédies: No.1 - Lent Et Grave, No.3 - Lent Et Douloureux",Classical,,,,,,,,,,,,,,,,,,,Charles Dutoit & L'Orchestre Symphonique de Montréal
333,Purcell: Music for the Queen Mary,"Music for the Funeral of Queen Mary: VI. ""Thou Knowest, Lord, the Secrets of Our Hearts""",Classical,,,,,,,,,,,,,,,,,,,"Equale Brass Ensemble, John Eliot Gardiner & Munich Monteverdi Orchestra and Choir"
334,Weill: The Seven Deadly Sins,Symphony No. 2: III. Allegro vivace,Classical,,,,,,,,,,,,,,,,,,,Kent Nagano and Orchestre de l'Opéra de Lyon
335,"J.S. Bach: Chaconne, Suite in E Minor, Partita in E Major & Prelude, Fugue and Allegro","Partita in E Major, BWV 1006A: I. Prelude",Classical,,,,,,,,,,,,,,,,,,,Julian Bream
336,Prokofiev: Symphony No.5 & Stravinksy: Le Sacre Du Printemps,Le Sacre Du Printemps: I.iv. Spring Rounds,Classical,,,,,,,,,,,,,,,,,,,Berliner Philharmoniker & Herbert Von Karajan
337,"Szymanowski: Piano Works, Vol. 1","Metopes, Op. 29: Calypso",Classical,,,,,,,,,,,,,,,,,,,Martin Roscoe
338,Nielsen: The Six Symphonies,"Symphony No. 2, Op. 16 -  ""The Four Temperaments"": II. Allegro Comodo e Flemmatico",Classical,,,,,,,,,,,,,,,,,,,Göteborgs Symfoniker & Neeme Järvi
339,Great Recordings of the Century: Paganini's 24 Caprices,"24 Caprices, Op. 1, No. 24, for Solo Violin, in A Minor",Classical,,,,,,,,,,,,,,,,,,,Itzhak Perlman
340,Liszt - 12 Études D'Execution Transcendante,"Étude 1, In C Major - Preludio (Presto) - Liszt",Classical,,,,,,,,,,,,,,,,,,,Michele Campanella
341,"Great Recordings of the Century - Shubert: Schwanengesang, 4 Lieder","Erlkonig, D.328",Classical,,,,,,,,,,,,,,,,,,,Gerald Moore
342,"Locatelli: Concertos for Violin, Strings and Continuo, Vol. 3","Concerto for Violin, Strings and Continuo in G Major, Op. 3, No. 9: I. Allegro",Classical,,,,,,,,,,,,,,,,,,,"Mela Tenenbaum, Pro Musica Prague & Richard Kapp"
343,Respighi:Pines of Rome,Pini Di Roma (Pinien Von Rom) \ I Pini Della Via Appia,Classical,,,,,,,,,,,,,,,,,,,Eugene Ormandy
344,Schubert: The Late String Quartets & String Quintet (3 CD's),"String Quartet No. 12 in C Minor, D. 703 ""Quartettsatz"": II. Andante - Allegro assai",Classical,,,,,,,,,,,,,,,,,,,Emerson String Quartet
345,Monteverdi: L'Orfeo,"L'orfeo, Act 3, Sinfonia (Orchestra)",Classical,,,,,,,,,,,,,,,,,,,"C. Monteverdi, Nigel Rogers - Chiaroscuro; London Baroque; London Cornett & Sackbu"
346,Mozart: Chamber Music,"Quintet for Horn, Violin, 2 Violas, and Cello in E Flat Major, K. 407/386c: III. Allegro",Classical,,,,,,,,,,,,,,,,,,,Nash Ensemble
347,Koyaanisqatsi (Soundtrack from the Motion Picture),Koyaanisqatsi,Soundtrack,,,,,,,,,,,,,,,,,,,Philip Glass Ensemble
